{
  "artifacts": [
    "artifact_inventory.json",
    "evidence_map.jsonl",
    "explicit_claims.jsonl",
    "gap_register.jsonl",
    "materialization.json",
    "mitigations.jsonl",
    "red_team_review.json",
    "repo_inventory.json",
    "report.json",
    "report.md",
    "review_corpus.jsonl",
    "review_scope.yml",
    "role_family_fit.json",
    "run_manifest.json",
    "screening_brief.md",
    "signal_ledger.jsonl",
    "summary-report.md",
    "work_chronology.json"
  ],
  "command_history": [
    {
      "command": "discover",
      "completed_at": "2026-06-25T11:27:53Z",
      "config": {
        "candidate": "https://github.com/MitchellQuinn",
        "out": "examples"
      }
    },
    {
      "command": "collect",
      "completed_at": "2026-06-25T11:29:19Z",
      "config": {
        "keep_worktrees": false,
        "scope": "C:\\Development\\agentic-skills\\workovercv\\examples\\mitchellquinn-20260625-1127Z\\review_scope.yml",
        "work_root": "C:\\Users\\Mitch\\.workovercv\\mitchellquinn\\worktrees"
      }
    },
    {
      "command": "analyze",
      "completed_at": "2026-06-25T11:29:51Z",
      "config": {
        "analysis_mode": "deterministic_rubric",
        "evidence_boundary": [
          "review_scope.yml",
          "repo_inventory.json",
          "artifact_inventory.json",
          "review_corpus.jsonl",
          "work_chronology.json"
        ],
        "generated_artifacts": [
          "explicit_claims.jsonl",
          "signal_ledger.jsonl",
          "evidence_map.jsonl",
          "gap_register.jsonl",
          "role_family_fit.json",
          "mitigations.jsonl",
          "red_team_review.json",
          "report.json"
        ],
        "run": "C:\\Development\\agentic-skills\\workovercv\\examples\\mitchellquinn-20260625-1127Z"
      }
    },
    {
      "command": "render",
      "completed_at": "2026-06-25T11:29:54Z",
      "config": {
        "report_mode": "audit",
        "run": "C:\\Development\\agentic-skills\\workovercv\\examples\\mitchellquinn-20260625-1127Z",
        "summary_report": "summary-report.md"
      }
    },
    {
      "command": "validate",
      "completed_at": "2026-06-25T11:30:00Z",
      "config": {
        "run": "C:\\Development\\agentic-skills\\workovercv\\examples\\mitchellquinn-20260625-1127Z"
      }
    },
    {
      "command": "validate",
      "completed_at": "2026-06-25T11:34:24Z",
      "config": {
        "run": "C:\\Development\\agentic-skills\\workovercv\\examples\\mitchellquinn-20260625-1127Z"
      }
    }
  ],
  "created_at": "2026-06-25T11:27:53Z",
  "output_dir": "C:\\Development\\agentic-skills\\workovercv\\examples\\mitchellquinn-20260625-1127Z",
  "status": "complete",
  "tool_name": "workovercv",
  "tool_version": "0.6.0",
  "updated_at": "2026-06-25T11:34:24Z",
  "warnings": [],
  "workflow_id": "workovercv.repository-employment-signal",
  "workflow_version": "0.6.0"
}
